{
  "$schema": "https://json-schema.org/draft/2020-12/schema",
  "title": "Mimir-Skills Decision Record v0.1",
  "description": "Machine-readable companion schema for canonical decision record JSON files. Structural validation lives here; helper validators may enforce stricter semantic checks such as calendar-valid IDs and UTC-only timestamps.",
  "type": "object",
  "required": [
    "id",
    "timestamp",
    "task_ref",
    "decision",
    "selected_option",
    "rationale",
    "evidence_refs",
    "affected_paths",
    "confidence"
  ],
  "properties": {
    "id": {
      "type": "string",
      "pattern": "^dec-\\d{8}-[a-z0-9-]+-\\d{3}$",
      "description": "Stable decision identifier. Helper validators should additionally require YYYYMMDD to be a valid calendar date."
    },
    "timestamp": {
      "$ref": "#/$defs/utcTimestamp"
    },
    "task_ref": {
      "type": "object",
      "required": [
        "source",
        "id",
        "title"
      ],
      "properties": {
        "source": {
          "type": "string",
          "enum": [
            "issue",
            "pr",
            "thread",
            "ci",
            "local",
            "other"
          ]
        },
        "id": {
          "$ref": "#/$defs/nonEmptyString"
        },
        "title": {
          "$ref": "#/$defs/nonEmptyString"
        }
      },
      "additionalProperties": true
    },
    "decision": {
      "$ref": "#/$defs/nonEmptyString"
    },
    "selected_option": {
      "type": "object",
      "required": [
        "name",
        "summary"
      ],
      "properties": {
        "name": {
          "$ref": "#/$defs/nonEmptyString"
        },
        "summary": {
          "$ref": "#/$defs/nonEmptyString"
        }
      },
      "additionalProperties": true
    },
    "rationale": {
      "$ref": "#/$defs/nonEmptyString"
    },
    "problem_context": {
      "type": "string"
    },
    "alternatives_considered": {
      "type": "array",
      "items": {
        "type": "object",
        "required": [
          "name",
          "status",
          "reason"
        ],
        "properties": {
          "name": {
            "$ref": "#/$defs/nonEmptyString"
          },
          "status": {
            "type": "string",
            "enum": [
              "rejected",
              "deferred",
              "selected"
            ]
          },
          "reason": {
            "$ref": "#/$defs/nonEmptyString"
          }
        },
        "additionalProperties": true
      }
    },
    "evidence_refs": {
      "type": "array",
      "minItems": 1,
      "items": {
        "type": "object",
        "required": [
          "kind",
          "ref",
          "summary",
          "captured_at"
        ],
        "properties": {
          "kind": {
            "type": "string",
            "enum": [
              "file",
              "diff",
              "test",
              "ci",
              "doc",
              "issue",
              "command",
              "discussion",
              "other"
            ]
          },
          "ref": {
            "$ref": "#/$defs/nonEmptyString"
          },
          "summary": {
            "$ref": "#/$defs/nonEmptyString"
          },
          "captured_at": {
            "$ref": "#/$defs/utcTimestamp"
          }
        },
        "additionalProperties": true
      }
    },
    "affected_paths": {
      "type": "array",
      "items": {
        "$ref": "#/$defs/nonEmptyString"
      }
    },
    "confidence": {
      "type": "number",
      "minimum": 0.0,
      "maximum": 1.0
    },
    "validation_run": {
      "type": "array",
      "items": {
        "type": "object",
        "required": [
          "type",
          "command",
          "result",
          "summary"
        ],
        "properties": {
          "type": {
            "type": "string",
            "enum": [
              "test",
              "build",
              "lint",
              "manual",
              "other"
            ]
          },
          "command": {
            "$ref": "#/$defs/nonEmptyString"
          },
          "result": {
            "type": "string",
            "enum": [
              "passed",
              "failed",
              "partial",
              "not_run"
            ]
          },
          "summary": {
            "$ref": "#/$defs/nonEmptyString"
          }
        },
        "additionalProperties": true
      }
    },
    "ai_assistance": {
      "type": "object",
      "properties": {
        "used": {
          "type": "boolean"
        },
        "summary": {
          "$ref": "#/$defs/nonEmptyString"
        },
        "tools": {
          "$ref": "#/$defs/nonEmptyStringArray"
        },
        "human_verification": {
          "$ref": "#/$defs/nonEmptyString"
        }
      },
      "additionalProperties": true
    },
    "approval": {
      "type": "object",
      "properties": {
        "required": {
          "type": "boolean"
        },
        "status": {
          "type": "string",
          "enum": [
            "not_required",
            "pending",
            "approved",
            "rejected"
          ]
        },
        "approver": {
          "$ref": "#/$defs/nonEmptyString"
        },
        "scope": {
          "$ref": "#/$defs/nonEmptyString"
        },
        "timestamp": {
          "$ref": "#/$defs/utcTimestamp"
        }
      },
      "additionalProperties": true
    },
    "change_scope": {
      "type": "object",
      "properties": {
        "risk_tier": {
          "type": "string",
          "enum": [
            "low",
            "medium",
            "high",
            "critical"
          ]
        },
        "blast_radius": {
          "$ref": "#/$defs/nonEmptyString"
        },
        "deployment_stage": {
          "type": "string",
          "enum": [
            "local",
            "ci",
            "staging",
            "canary",
            "production",
            "other"
          ]
        },
        "rollback_plan": {
          "$ref": "#/$defs/nonEmptyString"
        },
        "post_deploy_status": {
          "type": "string",
          "enum": [
            "not_started",
            "monitoring",
            "stable",
            "incident"
          ]
        },
        "post_deploy_summary": {
          "$ref": "#/$defs/nonEmptyString"
        }
      },
      "additionalProperties": true
    },
    "remaining_risks": {
      "$ref": "#/$defs/nonEmptyStringArray"
    },
    "follow_up": {
      "$ref": "#/$defs/nonEmptyStringArray"
    },
    "supersedes": {
      "$ref": "#/$defs/nonEmptyStringArray"
    }
  },
  "additionalProperties": true,
  "$defs": {
    "nonEmptyString": {
      "type": "string",
      "minLength": 1,
      "pattern": "\\S"
    },
    "nonEmptyStringArray": {
      "type": "array",
      "items": {
        "$ref": "#/$defs/nonEmptyString"
      }
    },
    "utcTimestamp": {
      "type": "string",
      "pattern": "^\\d{4}-\\d{2}-\\d{2}T\\d{2}:\\d{2}:\\d{2}(?:\\.\\d+)?(?:Z|\\+00:00)$",
      "description": "UTC timestamp string ending in Z or +00:00."
    }
  }
}
